
*** Running vivado
    with args -log nnp_stream_bd_s00_data_fifo_2.vds -m64 -product Vivado -mode batch -messageDb vivado.pb -notrace -source nnp_stream_bd_s00_data_fifo_2.tcl


****** Vivado v2018.1 (64-bit)
  **** SW Build 2188600 on Wed Apr  4 18:40:38 MDT 2018
  **** IP Build 2185939 on Wed Apr  4 20:55:05 MDT 2018
    ** Copyright 1986-2018 Xilinx, Inc. All Rights Reserved.

source nnp_stream_bd_s00_data_fifo_2.tcl -notrace
Command: synth_design -top nnp_stream_bd_s00_data_fifo_2 -part xc7z100ffg900-2 -mode out_of_context
Starting synth_design
Attempting to get a license for feature 'Synthesis' and/or device 'xc7z100'
INFO: [Common 17-349] Got license for feature 'Synthesis' and/or device 'xc7z100'
INFO: Launching helper process for spawning children vivado processes
INFO: Helper process launched with PID 1156 
---------------------------------------------------------------------------------
Starting RTL Elaboration : Time (s): cpu = 00:00:12 ; elapsed = 00:00:14 . Memory (MB): peak = 484.949 ; gain = 39.516
---------------------------------------------------------------------------------
INFO: [Synth 8-6157] synthesizing module 'nnp_stream_bd_s00_data_fifo_2' [e:/xfOpenCV/wksp_2018_1/nnp_mmult_04/Debug/_sds/p0/_vpl/ipi/syn/syn.srcs/sources_1/bd/nnp_stream_bd/ip/nnp_stream_bd_s00_data_fifo_2/synth/nnp_stream_bd_s00_data_fifo_2.v:58]
INFO: [Synth 8-6157] synthesizing module 'axi_data_fifo_v2_1_15_axi_data_fifo' [e:/xfOpenCV/wksp_2018_1/nnp_mmult_04/Debug/_sds/p0/_vpl/ipi/syn/syn.srcs/sources_1/bd/nnp_stream_bd/ipshared/d114/hdl/axi_data_fifo_v2_1_vl_rfs.v:1283]
	Parameter C_FAMILY bound to: zynq - type: string 
	Parameter C_AXI_PROTOCOL bound to: 1 - type: integer 
	Parameter C_AXI_ID_WIDTH bound to: 1 - type: integer 
	Parameter C_AXI_ADDR_WIDTH bound to: 32 - type: integer 
	Parameter C_AXI_DATA_WIDTH bound to: 64 - type: integer 
	Parameter C_AXI_SUPPORTS_USER_SIGNALS bound to: 0 - type: integer 
	Parameter C_AXI_AWUSER_WIDTH bound to: 1 - type: integer 
	Parameter C_AXI_ARUSER_WIDTH bound to: 1 - type: integer 
	Parameter C_AXI_WUSER_WIDTH bound to: 1 - type: integer 
	Parameter C_AXI_RUSER_WIDTH bound to: 1 - type: integer 
	Parameter C_AXI_BUSER_WIDTH bound to: 1 - type: integer 
	Parameter C_AXI_WRITE_FIFO_DEPTH bound to: 0 - type: integer 
	Parameter C_AXI_WRITE_FIFO_TYPE bound to: lut - type: string 
	Parameter C_AXI_WRITE_FIFO_DELAY bound to: 0 - type: integer 
	Parameter C_AXI_READ_FIFO_DEPTH bound to: 512 - type: integer 
	Parameter C_AXI_READ_FIFO_TYPE bound to: bram - type: string 
	Parameter C_AXI_READ_FIFO_DELAY bound to: 1 - type: integer 
	Parameter P_WIDTH_RACH bound to: 60 - type: integer 
	Parameter P_WIDTH_WACH bound to: 60 - type: integer 
	Parameter P_WIDTH_RDCH bound to: 69 - type: integer 
	Parameter P_WIDTH_WDCH bound to: 75 - type: integer 
	Parameter P_WIDTH_WRCH bound to: 4 - type: integer 
	Parameter P_PRIM_FIFO_TYPE bound to: 512x72 - type: string 
	Parameter P_AXI4 bound to: 0 - type: integer 
	Parameter P_AXI3 bound to: 1 - type: integer 
	Parameter P_AXILITE bound to: 2 - type: integer 
	Parameter P_WRITE_FIFO_DEPTH_LOG bound to: 1 - type: integer 
	Parameter P_READ_FIFO_DEPTH_LOG bound to: 9 - type: integer 
INFO: [Synth 8-6157] synthesizing module 'xpm_cdc_async_rst' [D:/Xilinx/Vivado/2018.1/data/ip/xpm/xpm_cdc/hdl/xpm_cdc.sv:1171]
INFO: [Synth 8-5534] Detected attribute (* ASYNC_REG = "TRUE" *) [D:/Xilinx/Vivado/2018.1/data/ip/xpm/xpm_cdc/hdl/xpm_cdc.sv:1222]
INFO: [Synth 8-6155] done synthesizing module 'xpm_cdc_async_rst' (1#1) [D:/Xilinx/Vivado/2018.1/data/ip/xpm/xpm_cdc/hdl/xpm_cdc.sv:1171]
INFO: [Synth 8-6157] synthesizing module 'xpm_cdc_sync_rst' [D:/Xilinx/Vivado/2018.1/data/ip/xpm/xpm_cdc/hdl/xpm_cdc.sv:1055]
INFO: [Synth 8-5534] Detected attribute (* ASYNC_REG = "TRUE" *) [D:/Xilinx/Vivado/2018.1/data/ip/xpm/xpm_cdc/hdl/xpm_cdc.sv:1107]
INFO: [Synth 8-6155] done synthesizing module 'xpm_cdc_sync_rst' (20#1) [D:/Xilinx/Vivado/2018.1/data/ip/xpm/xpm_cdc/hdl/xpm_cdc.sv:1055]
INFO: [Synth 8-6155] done synthesizing module 'axi_data_fifo_v2_1_15_axi_data_fifo' (31#1) [e:/xfOpenCV/wksp_2018_1/nnp_mmult_04/Debug/_sds/p0/_vpl/ipi/syn/syn.srcs/sources_1/bd/nnp_stream_bd/ipshared/d114/hdl/axi_data_fifo_v2_1_vl_rfs.v:1283]
INFO: [Synth 8-6155] done synthesizing module 'nnp_stream_bd_s00_data_fifo_2' (32#1) [e:/xfOpenCV/wksp_2018_1/nnp_mmult_04/Debug/_sds/p0/_vpl/ipi/syn/syn.srcs/sources_1/bd/nnp_stream_bd/ip/nnp_stream_bd_s00_data_fifo_2/synth/nnp_stream_bd_s00_data_fifo_2.v:58]
WARNING: [Synth 8-3331] design reset_blk_ramfifo__parameterized1 has unconnected port RD_CLK
WARNING: [Synth 8-3331] design reset_blk_ramfifo__parameterized1 has unconnected port WR_RST
WARNING: [Synth 8-3331] design reset_blk_ramfifo__parameterized1 has unconnected port RD_RST
WARNING: [Synth 8-3331] design reset_blk_ramfifo__parameterized1 has unconnected port SRST
WARNING: [Synth 8-3331] design wr_pf_ss__parameterized0 has unconnected port PROG_FULL
WARNING: [Synth 8-3331] design wr_pf_ss__parameterized0 has unconnected port PROG_FULL_THRESH[8]
WARNING: [Synth 8-3331] design wr_pf_ss__parameterized0 has unconnected port PROG_FULL_THRESH[7]
WARNING: [Synth 8-3331] design wr_pf_ss__parameterized0 has unconnected port PROG_FULL_THRESH[6]
WARNING: [Synth 8-3331] design wr_pf_ss__parameterized0 has unconnected port PROG_FULL_THRESH[5]
WARNING: [Synth 8-3331] design wr_pf_ss__parameterized0 has unconnected port PROG_FULL_THRESH[4]
WARNING: [Synth 8-3331] design wr_pf_ss__parameterized0 has unconnected port PROG_FULL_THRESH[3]
WARNING: [Synth 8-3331] design wr_pf_ss__parameterized0 has unconnected port PROG_FULL_THRESH[2]
WARNING: [Synth 8-3331] design wr_pf_ss__parameterized0 has unconnected port PROG_FULL_THRESH[1]
WARNING: [Synth 8-3331] design wr_pf_ss__parameterized0 has unconnected port PROG_FULL_THRESH[0]
WARNING: [Synth 8-3331] design wr_pf_ss__parameterized0 has unconnected port PROG_FULL_THRESH_ASSERT[8]
WARNING: [Synth 8-3331] design wr_pf_ss__parameterized0 has unconnected port PROG_FULL_THRESH_ASSERT[7]
WARNING: [Synth 8-3331] design wr_pf_ss__parameterized0 has unconnected port PROG_FULL_THRESH_ASSERT[6]
WARNING: [Synth 8-3331] design wr_pf_ss__parameterized0 has unconnected port PROG_FULL_THRESH_ASSERT[5]
WARNING: [Synth 8-3331] design wr_pf_ss__parameterized0 has unconnected port PROG_FULL_THRESH_ASSERT[4]
WARNING: [Synth 8-3331] design wr_pf_ss__parameterized0 has unconnected port PROG_FULL_THRESH_ASSERT[3]
WARNING: [Synth 8-3331] design wr_pf_ss__parameterized0 has unconnected port PROG_FULL_THRESH_ASSERT[2]
WARNING: [Synth 8-3331] design wr_pf_ss__parameterized0 has unconnected port PROG_FULL_THRESH_ASSERT[1]
WARNING: [Synth 8-3331] design wr_pf_ss__parameterized0 has unconnected port PROG_FULL_THRESH_ASSERT[0]
WARNING: [Synth 8-3331] design wr_pf_ss__parameterized0 has unconnected port PROG_FULL_THRESH_NEGATE[8]
WARNING: [Synth 8-3331] design wr_pf_ss__parameterized0 has unconnected port PROG_FULL_THRESH_NEGATE[7]
WARNING: [Synth 8-3331] design wr_pf_ss__parameterized0 has unconnected port PROG_FULL_THRESH_NEGATE[6]
WARNING: [Synth 8-3331] design wr_pf_ss__parameterized0 has unconnected port PROG_FULL_THRESH_NEGATE[5]
WARNING: [Synth 8-3331] design wr_pf_ss__parameterized0 has unconnected port PROG_FULL_THRESH_NEGATE[4]
WARNING: [Synth 8-3331] design wr_pf_ss__parameterized0 has unconnected port PROG_FULL_THRESH_NEGATE[3]
WARNING: [Synth 8-3331] design wr_pf_ss__parameterized0 has unconnected port PROG_FULL_THRESH_NEGATE[2]
WARNING: [Synth 8-3331] design wr_pf_ss__parameterized0 has unconnected port PROG_FULL_THRESH_NEGATE[1]
WARNING: [Synth 8-3331] design wr_pf_ss__parameterized0 has unconnected port PROG_FULL_THRESH_NEGATE[0]
WARNING: [Synth 8-3331] design wr_pf_ss__parameterized0 has unconnected port WR_CLK
WARNING: [Synth 8-3331] design wr_pf_ss__parameterized0 has unconnected port SRST
WARNING: [Synth 8-3331] design wr_pf_ss__parameterized0 has unconnected port WR_RST
WARNING: [Synth 8-3331] design wr_pf_ss__parameterized0 has unconnected port RST_FULL_GEN
WARNING: [Synth 8-3331] design wr_pf_ss__parameterized0 has unconnected port RST_FULL_FF
WARNING: [Synth 8-3331] design wr_pf_ss__parameterized0 has unconnected port SRST_FULL_FF
WARNING: [Synth 8-3331] design wr_pf_ss__parameterized0 has unconnected port RAM_WR_EN
WARNING: [Synth 8-3331] design wr_pf_ss__parameterized0 has unconnected port FULL
WARNING: [Synth 8-3331] design wr_pf_ss__parameterized0 has unconnected port EMPTY
WARNING: [Synth 8-3331] design wr_pf_ss__parameterized0 has unconnected port RAM_RD_EN
WARNING: [Synth 8-3331] design wr_pf_ss__parameterized0 has unconnected port RAM_ALMOST_FULL
WARNING: [Synth 8-3331] design wr_pf_ss__parameterized0 has unconnected port RAM_ALMOST_EMPTY
WARNING: [Synth 8-3331] design wr_pf_ss__parameterized0 has unconnected port WR_PNTR[8]
WARNING: [Synth 8-3331] design wr_pf_ss__parameterized0 has unconnected port WR_PNTR[7]
WARNING: [Synth 8-3331] design wr_pf_ss__parameterized0 has unconnected port WR_PNTR[6]
WARNING: [Synth 8-3331] design wr_pf_ss__parameterized0 has unconnected port WR_PNTR[5]
WARNING: [Synth 8-3331] design wr_pf_ss__parameterized0 has unconnected port WR_PNTR[4]
WARNING: [Synth 8-3331] design wr_pf_ss__parameterized0 has unconnected port WR_PNTR[3]
WARNING: [Synth 8-3331] design wr_pf_ss__parameterized0 has unconnected port WR_PNTR[2]
WARNING: [Synth 8-3331] design wr_pf_ss__parameterized0 has unconnected port WR_PNTR[1]
WARNING: [Synth 8-3331] design wr_pf_ss__parameterized0 has unconnected port WR_PNTR[0]
WARNING: [Synth 8-3331] design wr_pf_ss__parameterized0 has unconnected port WR_PNTR_PLUS1[8]
WARNING: [Synth 8-3331] design wr_pf_ss__parameterized0 has unconnected port WR_PNTR_PLUS1[7]
WARNING: [Synth 8-3331] design wr_pf_ss__parameterized0 has unconnected port WR_PNTR_PLUS1[6]
WARNING: [Synth 8-3331] design wr_pf_ss__parameterized0 has unconnected port WR_PNTR_PLUS1[5]
WARNING: [Synth 8-3331] design wr_pf_ss__parameterized0 has unconnected port WR_PNTR_PLUS1[4]
WARNING: [Synth 8-3331] design wr_pf_ss__parameterized0 has unconnected port WR_PNTR_PLUS1[3]
WARNING: [Synth 8-3331] design wr_pf_ss__parameterized0 has unconnected port WR_PNTR_PLUS1[2]
WARNING: [Synth 8-3331] design wr_pf_ss__parameterized0 has unconnected port WR_PNTR_PLUS1[1]
WARNING: [Synth 8-3331] design wr_pf_ss__parameterized0 has unconnected port WR_PNTR_PLUS1[0]
WARNING: [Synth 8-3331] design wr_pf_ss__parameterized0 has unconnected port RD_PNTR_WR[8]
WARNING: [Synth 8-3331] design wr_pf_ss__parameterized0 has unconnected port RD_PNTR_WR[7]
WARNING: [Synth 8-3331] design wr_pf_ss__parameterized0 has unconnected port RD_PNTR_WR[6]
WARNING: [Synth 8-3331] design wr_pf_ss__parameterized0 has unconnected port RD_PNTR_WR[5]
WARNING: [Synth 8-3331] design wr_pf_ss__parameterized0 has unconnected port RD_PNTR_WR[4]
WARNING: [Synth 8-3331] design wr_pf_ss__parameterized0 has unconnected port RD_PNTR_WR[3]
WARNING: [Synth 8-3331] design wr_pf_ss__parameterized0 has unconnected port RD_PNTR_WR[2]
WARNING: [Synth 8-3331] design wr_pf_ss__parameterized0 has unconnected port RD_PNTR_WR[1]
WARNING: [Synth 8-3331] design wr_pf_ss__parameterized0 has unconnected port RD_PNTR_WR[0]
WARNING: [Synth 8-3331] design wr_status_flags_ss__parameterized0 has unconnected port RST_FULL_FF
WARNING: [Synth 8-3331] design wr_status_flags_ss__parameterized0 has unconnected port WR_RST
WARNING: [Synth 8-3331] design wr_status_flags_ss__parameterized0 has unconnected port SRST
WARNING: [Synth 8-3331] design wr_status_flags_ss__parameterized0 has unconnected port SAFETY_CKT_WR_RST
WARNING: [Synth 8-3331] design wr_status_flags_ss__parameterized0 has unconnected port WR_PNTR_PLUS2[8]
WARNING: [Synth 8-3331] design wr_status_flags_ss__parameterized0 has unconnected port WR_PNTR_PLUS2[7]
WARNING: [Synth 8-3331] design wr_status_flags_ss__parameterized0 has unconnected port WR_PNTR_PLUS2[6]
WARNING: [Synth 8-3331] design wr_status_flags_ss__parameterized0 has unconnected port WR_PNTR_PLUS2[5]
WARNING: [Synth 8-3331] design wr_status_flags_ss__parameterized0 has unconnected port WR_PNTR_PLUS2[4]
WARNING: [Synth 8-3331] design wr_status_flags_ss__parameterized0 has unconnected port WR_PNTR_PLUS2[3]
WARNING: [Synth 8-3331] design wr_status_flags_ss__parameterized0 has unconnected port WR_PNTR_PLUS2[2]
WARNING: [Synth 8-3331] design wr_status_flags_ss__parameterized0 has unconnected port WR_PNTR_PLUS2[1]
WARNING: [Synth 8-3331] design wr_status_flags_ss__parameterized0 has unconnected port WR_PNTR_PLUS2[0]
WARNING: [Synth 8-3331] design wr_status_flags_ss__parameterized0 has unconnected port WR_PNTR_PLUS3[8]
WARNING: [Synth 8-3331] design wr_status_flags_ss__parameterized0 has unconnected port WR_PNTR_PLUS3[7]
WARNING: [Synth 8-3331] design wr_status_flags_ss__parameterized0 has unconnected port WR_PNTR_PLUS3[6]
WARNING: [Synth 8-3331] design wr_status_flags_ss__parameterized0 has unconnected port WR_PNTR_PLUS3[5]
WARNING: [Synth 8-3331] design wr_status_flags_ss__parameterized0 has unconnected port WR_PNTR_PLUS3[4]
WARNING: [Synth 8-3331] design wr_status_flags_ss__parameterized0 has unconnected port WR_PNTR_PLUS3[3]
WARNING: [Synth 8-3331] design wr_status_flags_ss__parameterized0 has unconnected port WR_PNTR_PLUS3[2]
WARNING: [Synth 8-3331] design wr_status_flags_ss__parameterized0 has unconnected port WR_PNTR_PLUS3[1]
WARNING: [Synth 8-3331] design wr_status_flags_ss__parameterized0 has unconnected port WR_PNTR_PLUS3[0]
WARNING: [Synth 8-3331] design wr_bin_cntr__parameterized0 has unconnected port RST
WARNING: [Synth 8-3331] design wr_logic__parameterized0 has unconnected port WR_EN_INTO_LOGIC
WARNING: [Synth 8-3331] design wr_logic__parameterized0 has unconnected port WR_RST_INTO_LOGIC
WARNING: [Synth 8-3331] design wr_logic__parameterized0 has unconnected port RD_EN
WARNING: [Synth 8-3331] design wr_logic__parameterized0 has unconnected port WR_RST_BUSY
WARNING: [Synth 8-3331] design rd_fwft__parameterized0 has unconnected port RD_RST
WARNING: [Synth 8-3331] design rd_fwft__parameterized0 has unconnected port SAFETY_CKT_RD_RST
INFO: [Common 17-14] Message 'Synth 8-3331' appears 100 times and further instances of the messages will be disabled. Use the Tcl command set_msg_config to change the current settings.
---------------------------------------------------------------------------------
Finished RTL Elaboration : Time (s): cpu = 00:01:25 ; elapsed = 00:01:28 . Memory (MB): peak = 769.797 ; gain = 324.363
---------------------------------------------------------------------------------

Report Check Netlist: 
+------+------------------+-------+---------+-------+------------------+
|      |Item              |Errors |Warnings |Status |Description       |
+------+------------------+-------+---------+-------+------------------+
|1     |multi_driven_nets |      0|        0|Passed |Multi driven nets |
+------+------------------+-------+---------+-------+------------------+
---------------------------------------------------------------------------------
Start Handling Custom Attributes
---------------------------------------------------------------------------------
---------------------------------------------------------------------------------
Finished Handling Custom Attributes : Time (s): cpu = 00:01:26 ; elapsed = 00:01:29 . Memory (MB): peak = 769.797 ; gain = 324.363
---------------------------------------------------------------------------------
---------------------------------------------------------------------------------
Finished RTL Optimization Phase 1 : Time (s): cpu = 00:01:26 ; elapsed = 00:01:29 . Memory (MB): peak = 769.797 ; gain = 324.363
---------------------------------------------------------------------------------
INFO: [Netlist 29-17] Analyzing 21 Unisim elements for replacement
INFO: [Netlist 29-28] Unisim Transformation completed in 0 CPU seconds
INFO: [Device 21-403] Loading part xc7z100ffg900-2
INFO: [Project 1-570] Preparing netlist for logic optimization

Processing XDC Constraints
Initializing timing engine
Parsing XDC File [e:/xfOpenCV/wksp_2018_1/nnp_mmult_04/Debug/_sds/p0/_vpl/ipi/syn/syn.srcs/sources_1/bd/nnp_stream_bd/ip/nnp_stream_bd_s00_data_fifo_2/nnp_stream_bd_s00_data_fifo_2_ooc.xdc] for cell 'inst'
Finished Parsing XDC File [e:/xfOpenCV/wksp_2018_1/nnp_mmult_04/Debug/_sds/p0/_vpl/ipi/syn/syn.srcs/sources_1/bd/nnp_stream_bd/ip/nnp_stream_bd_s00_data_fifo_2/nnp_stream_bd_s00_data_fifo_2_ooc.xdc] for cell 'inst'
Parsing XDC File [E:/xfOpenCV/wksp_2018_1/nnp_mmult_04/Debug/_sds/p0/_vpl/ipi/syn/syn.runs/nnp_stream_bd_s00_data_fifo_2_synth_1/dont_touch.xdc]
Finished Parsing XDC File [E:/xfOpenCV/wksp_2018_1/nnp_mmult_04/Debug/_sds/p0/_vpl/ipi/syn/syn.runs/nnp_stream_bd_s00_data_fifo_2_synth_1/dont_touch.xdc]
Sourcing Tcl File [D:/Xilinx/Vivado/2018.1/data/ip/xpm/xpm_cdc/tcl/xpm_cdc_async_rst.tcl] for cell 'inst/gen_fifo.fifo_gen_inst/inst_fifo_gen/gaxi_full_lite.gread_ch.grach2.axi_rach/grf.rf/rstblk/ngwrdrst.grst.g7serrst.gnsckt_wrst.rst_wr_reg2_inst'
Finished Sourcing Tcl File [D:/Xilinx/Vivado/2018.1/data/ip/xpm/xpm_cdc/tcl/xpm_cdc_async_rst.tcl] for cell 'inst/gen_fifo.fifo_gen_inst/inst_fifo_gen/gaxi_full_lite.gread_ch.grach2.axi_rach/grf.rf/rstblk/ngwrdrst.grst.g7serrst.gnsckt_wrst.rst_wr_reg2_inst'
Sourcing Tcl File [D:/Xilinx/Vivado/2018.1/data/ip/xpm/xpm_cdc/tcl/xpm_cdc_async_rst.tcl] for cell 'inst/gen_fifo.fifo_gen_inst/inst_fifo_gen/gaxi_full_lite.gread_ch.grach2.gaxi_arvld.rach_pkt_reg_slice/rstblk/ngwrdrst.grst.g7serrst.gnsckt_wrst.rst_wr_reg2_inst'
Finished Sourcing Tcl File [D:/Xilinx/Vivado/2018.1/data/ip/xpm/xpm_cdc/tcl/xpm_cdc_async_rst.tcl] for cell 'inst/gen_fifo.fifo_gen_inst/inst_fifo_gen/gaxi_full_lite.gread_ch.grach2.gaxi_arvld.rach_pkt_reg_slice/rstblk/ngwrdrst.grst.g7serrst.gnsckt_wrst.rst_wr_reg2_inst'
Sourcing Tcl File [D:/Xilinx/Vivado/2018.1/data/ip/xpm/xpm_cdc/tcl/xpm_cdc_async_rst.tcl] for cell 'inst/gen_fifo.fifo_gen_inst/inst_fifo_gen/reset_gen_cc.rstblk_cc/ngwrdrst.grst.g7serrst.gnsckt_wrst.rst_wr_reg2_inst'
Finished Sourcing Tcl File [D:/Xilinx/Vivado/2018.1/data/ip/xpm/xpm_cdc/tcl/xpm_cdc_async_rst.tcl] for cell 'inst/gen_fifo.fifo_gen_inst/inst_fifo_gen/reset_gen_cc.rstblk_cc/ngwrdrst.grst.g7serrst.gnsckt_wrst.rst_wr_reg2_inst'
INFO: [Project 1-236] Implementation specific constraints were found while reading constraint file [D:/Xilinx/Vivado/2018.1/data/ip/xpm/xpm_cdc/tcl/xpm_cdc_async_rst.tcl]. These constraints will be ignored for synthesis but will be used in implementation. Impacted constraints are listed in the file [.Xil/nnp_stream_bd_s00_data_fifo_2_propImpl.xdc].
Resolution: To avoid this warning, move constraints listed in [.Xil/nnp_stream_bd_s00_data_fifo_2_propImpl.xdc] to another XDC file and exclude this new file from synthesis with the used_in_synthesis property (File Properties dialog in GUI) and re-run elaboration/synthesis.
Sourcing Tcl File [D:/Xilinx/Vivado/2018.1/data/ip/xpm/xpm_cdc/tcl/xpm_cdc_sync_rst.tcl] for cell 'inst/gen_fifo.fifo_gen_inst/inst_fifo_gen/gaxi_full_lite.gread_ch.grdch2.axi_rdch/grf.rf/rstblk/ngwrdrst.grst.g7serrst.gsckt_wrst.xpm_cdc_sync_rst_inst_wrst'
Finished Sourcing Tcl File [D:/Xilinx/Vivado/2018.1/data/ip/xpm/xpm_cdc/tcl/xpm_cdc_sync_rst.tcl] for cell 'inst/gen_fifo.fifo_gen_inst/inst_fifo_gen/gaxi_full_lite.gread_ch.grdch2.axi_rdch/grf.rf/rstblk/ngwrdrst.grst.g7serrst.gsckt_wrst.xpm_cdc_sync_rst_inst_wrst'
Completed Processing XDC Constraints

INFO: [Project 1-111] Unisim Transformation Summary:
No Unisim elements were transformed.

Constraint Validation Runtime : Time (s): cpu = 00:00:00 ; elapsed = 00:00:00.037 . Memory (MB): peak = 975.691 ; gain = 1.125
---------------------------------------------------------------------------------
Finished Constraint Validation : Time (s): cpu = 00:01:44 ; elapsed = 00:01:49 . Memory (MB): peak = 975.691 ; gain = 530.258
---------------------------------------------------------------------------------
---------------------------------------------------------------------------------
Start Loading Part and Timing Information
---------------------------------------------------------------------------------
Loading part: xc7z100ffg900-2
---------------------------------------------------------------------------------
Finished Loading Part and Timing Information : Time (s): cpu = 00:01:44 ; elapsed = 00:01:49 . Memory (MB): peak = 975.691 ; gain = 530.258
---------------------------------------------------------------------------------
---------------------------------------------------------------------------------
Start Applying 'set_property' XDC Constraints
---------------------------------------------------------------------------------
Applied set_property DONT_TOUCH = true for inst. (constraint file  E:/xfOpenCV/wksp_2018_1/nnp_mmult_04/Debug/_sds/p0/_vpl/ipi/syn/syn.runs/nnp_stream_bd_s00_data_fifo_2_synth_1/dont_touch.xdc, line 9).
Applied set_property DONT_TOUCH = true for inst/\gen_fifo.fifo_gen_inst /inst_fifo_gen/\reset_gen_cc.rstblk_cc /\ngwrdrst.grst.g7serrst.gnsckt_wrst.rst_wr_reg2_inst . (constraint file  auto generated constraint, line ).
Applied set_property DONT_TOUCH = true for inst/\gen_fifo.fifo_gen_inst /inst_fifo_gen/\gaxi_full_lite.gread_ch.grach2.axi_rach /\grf.rf /rstblk/\ngwrdrst.grst.g7serrst.gnsckt_wrst.rst_wr_reg2_inst . (constraint file  auto generated constraint, line ).
Applied set_property DONT_TOUCH = true for inst/\gen_fifo.fifo_gen_inst /inst_fifo_gen/\gaxi_full_lite.gread_ch.grach2.gaxi_arvld.rach_pkt_reg_slice /rstblk/\ngwrdrst.grst.g7serrst.gnsckt_wrst.rst_wr_reg2_inst . (constraint file  auto generated constraint, line ).
Applied set_property DONT_TOUCH = true for inst/\gen_fifo.fifo_gen_inst /inst_fifo_gen/\gaxi_full_lite.gread_ch.grdch2.axi_rdch /\grf.rf /rstblk/\ngwrdrst.grst.g7serrst.gsckt_wrst.xpm_cdc_sync_rst_inst_wrst . (constraint file  auto generated constraint, line ).
---------------------------------------------------------------------------------
Finished applying 'set_property' XDC Constraints : Time (s): cpu = 00:01:44 ; elapsed = 00:01:49 . Memory (MB): peak = 975.691 ; gain = 530.258
---------------------------------------------------------------------------------
INFO: [Synth 8-5544] ROM "leaving_empty_fwft" won't be mapped to Block RAM because address size (2) smaller than threshold (5)
INFO: [Synth 8-5544] ROM "leaving_empty_fwft" won't be mapped to Block RAM because address size (2) smaller than threshold (5)
---------------------------------------------------------------------------------
Finished RTL Optimization Phase 2 : Time (s): cpu = 00:01:45 ; elapsed = 00:01:51 . Memory (MB): peak = 975.691 ; gain = 530.258
---------------------------------------------------------------------------------

Report RTL Partitions: 
+-+--------------+------------+----------+
| |RTL Partition |Replication |Instances |
+-+--------------+------------+----------+
+-+--------------+------------+----------+
---------------------------------------------------------------------------------
Start RTL Component Statistics 
---------------------------------------------------------------------------------
Detailed RTL Component Info : 
+---Adders : 
	   3 Input     10 Bit       Adders := 2     
	   2 Input      9 Bit       Adders := 2     
	   2 Input      5 Bit       Adders := 3     
+---XORs : 
	   2 Input      1 Bit         XORs := 58    
+---Registers : 
	               69 Bit    Registers := 1     
	               60 Bit    Registers := 3     
	               10 Bit    Registers := 1     
	                9 Bit    Registers := 4     
	                5 Bit    Registers := 7     
	                4 Bit    Registers := 4     
	                2 Bit    Registers := 5     
	                1 Bit    Registers := 43    
+---Muxes : 
	   2 Input     10 Bit        Muxes := 2     
	   2 Input      2 Bit        Muxes := 8     
	   5 Input      2 Bit        Muxes := 2     
	   3 Input      1 Bit        Muxes := 2     
	   2 Input      1 Bit        Muxes := 16    
	   4 Input      1 Bit        Muxes := 4     
---------------------------------------------------------------------------------
Finished RTL Component Statistics 
---------------------------------------------------------------------------------
---------------------------------------------------------------------------------
Start RTL Hierarchical Component Statistics 
---------------------------------------------------------------------------------
Hierarchical RTL Component report 
Module xpm_cdc_async_rst 
Detailed RTL Component Info : 
+---Registers : 
	                2 Bit    Registers := 1     
Module reset_blk_ramfifo 
Detailed RTL Component Info : 
+---Registers : 
	                4 Bit    Registers := 1     
	                1 Bit    Registers := 3     
Module reset_blk_ramfifo__parameterized0 
Detailed RTL Component Info : 
+---Registers : 
	                4 Bit    Registers := 1     
	                1 Bit    Registers := 3     
Module dmem 
Detailed RTL Component Info : 
+---Registers : 
	               60 Bit    Registers := 1     
Module memory 
Detailed RTL Component Info : 
+---Registers : 
	               60 Bit    Registers := 1     
Module rd_bin_cntr 
Detailed RTL Component Info : 
+---Adders : 
	   2 Input      5 Bit       Adders := 1     
+---Registers : 
	                5 Bit    Registers := 2     
Module compare 
Detailed RTL Component Info : 
+---XORs : 
	   2 Input      1 Bit         XORs := 5     
Module rd_status_flags_ss 
Detailed RTL Component Info : 
+---Registers : 
	                1 Bit    Registers := 2     
Module rd_fwft 
Detailed RTL Component Info : 
+---Registers : 
	                2 Bit    Registers := 1     
	                1 Bit    Registers := 6     
+---Muxes : 
	   2 Input      2 Bit        Muxes := 4     
	   5 Input      2 Bit        Muxes := 1     
	   3 Input      1 Bit        Muxes := 1     
	   2 Input      1 Bit        Muxes := 3     
	   4 Input      1 Bit        Muxes := 2     
Module wr_bin_cntr 
Detailed RTL Component Info : 
+---Adders : 
	   2 Input      5 Bit       Adders := 1     
+---Registers : 
	                5 Bit    Registers := 2     
Module wr_status_flags_ss 
Detailed RTL Component Info : 
+---Registers : 
	                1 Bit    Registers := 2     
Module xpm_cdc_sync_rst 
Detailed RTL Component Info : 
+---Registers : 
	                5 Bit    Registers := 1     
Module reset_blk_ramfifo__parameterized2 
Detailed RTL Component Info : 
+---Registers : 
	                4 Bit    Registers := 1     
	                1 Bit    Registers := 3     
Module blk_mem_gen_prim_width 
Detailed RTL Component Info : 
+---XORs : 
	   2 Input      1 Bit         XORs := 2     
+---Registers : 
	                5 Bit    Registers := 2     
	                1 Bit    Registers := 8     
Module memory__parameterized0 
Detailed RTL Component Info : 
+---Registers : 
	               69 Bit    Registers := 1     
Module rd_bin_cntr__parameterized0 
Detailed RTL Component Info : 
+---Adders : 
	   2 Input      9 Bit       Adders := 1     
+---Registers : 
	                9 Bit    Registers := 2     
Module compare__parameterized0 
Detailed RTL Component Info : 
+---XORs : 
	   2 Input      1 Bit         XORs := 9     
Module rd_status_flags_ss__parameterized0 
Detailed RTL Component Info : 
+---Registers : 
	                1 Bit    Registers := 2     
+---Muxes : 
	   2 Input      1 Bit        Muxes := 1     
Module rd_fwft__parameterized0 
Detailed RTL Component Info : 
+---Registers : 
	                2 Bit    Registers := 1     
	                1 Bit    Registers := 6     
+---Muxes : 
	   2 Input      2 Bit        Muxes := 4     
	   5 Input      2 Bit        Muxes := 1     
	   3 Input      1 Bit        Muxes := 1     
	   2 Input      1 Bit        Muxes := 5     
	   4 Input      1 Bit        Muxes := 2     
Module wr_bin_cntr__parameterized0 
Detailed RTL Component Info : 
+---Adders : 
	   2 Input      9 Bit       Adders := 1     
+---Registers : 
	                9 Bit    Registers := 2     
Module wr_status_flags_ss__parameterized0 
Detailed RTL Component Info : 
+---Registers : 
	                1 Bit    Registers := 2     
+---Muxes : 
	   2 Input      1 Bit        Muxes := 1     
Module reset_blk_ramfifo__parameterized1 
Detailed RTL Component Info : 
+---Registers : 
	                4 Bit    Registers := 1     
	                1 Bit    Registers := 3     
Module axi_reg_slice 
Detailed RTL Component Info : 
+---Registers : 
	               60 Bit    Registers := 1     
	                1 Bit    Registers := 3     
+---Muxes : 
	   2 Input      1 Bit        Muxes := 4     
Module fifo_generator_v13_2_2_synth 
Detailed RTL Component Info : 
+---Adders : 
	   3 Input     10 Bit       Adders := 2     
	   2 Input      5 Bit       Adders := 1     
+---Registers : 
	               10 Bit    Registers := 1     
+---Muxes : 
	   2 Input     10 Bit        Muxes := 2     
	   2 Input      1 Bit        Muxes := 2     
---------------------------------------------------------------------------------
Finished RTL Hierarchical Component Statistics
---------------------------------------------------------------------------------
---------------------------------------------------------------------------------
Start Part Resource Summary
---------------------------------------------------------------------------------
Part Resources:
DSPs: 2020 (col length:140)
BRAMs: 1510 (col length: RAMB18 140 RAMB36 70)
---------------------------------------------------------------------------------
Finished Part Resource Summary
---------------------------------------------------------------------------------
---------------------------------------------------------------------------------
Start Cross Boundary and Area Optimization
---------------------------------------------------------------------------------
Warning: Parallel synthesis criteria is not met 
INFO: [Synth 8-3886] merging instance 'inst/gen_fifo.fifo_gen_inst/inst_fifo_gen/gaxi_full_lite.gread_ch.grdch2.axi_rdch/grf.rf/gntv_or_sync_fifo.mem/gbm.gbmg.gbmga.ngecc.bmg/inst_blk_mem_gen/gnbram.gnativebmg.native_blk_mem_gen/valid.cstr/ramloop[0].ram.r/SAFETY_CKT_GEN.RSTA_SHFT_REG_reg[0]' (FDS) to 'inst/gen_fifo.fifo_gen_inst/inst_fifo_gen/gaxi_full_lite.gread_ch.grdch2.axi_rdch/grf.rf/gntv_or_sync_fifo.mem/gbm.gbmg.gbmga.ngecc.bmg/inst_blk_mem_gen/gnbram.gnativebmg.native_blk_mem_gen/valid.cstr/ramloop[0].ram.r/SAFETY_CKT_GEN.RSTB_SHFT_REG_reg[0]'
INFO: [Synth 8-3886] merging instance 'inst/gen_fifo.fifo_gen_inst/inst_fifo_gen/gaxi_full_lite.gread_ch.grdch2.axi_rdch/grf.rf/gntv_or_sync_fifo.mem/gbm.gbmg.gbmga.ngecc.bmg/inst_blk_mem_gen/gnbram.gnativebmg.native_blk_mem_gen/valid.cstr/ramloop[0].ram.r/SAFETY_CKT_GEN.RSTA_SHFT_REG_reg[1]' (FD) to 'inst/gen_fifo.fifo_gen_inst/inst_fifo_gen/gaxi_full_lite.gread_ch.grdch2.axi_rdch/grf.rf/gntv_or_sync_fifo.mem/gbm.gbmg.gbmga.ngecc.bmg/inst_blk_mem_gen/gnbram.gnativebmg.native_blk_mem_gen/valid.cstr/ramloop[0].ram.r/SAFETY_CKT_GEN.RSTB_SHFT_REG_reg[1]'
INFO: [Synth 8-3886] merging instance 'inst/gen_fifo.fifo_gen_inst/inst_fifo_gen/gaxi_full_lite.gread_ch.grdch2.axi_rdch/grf.rf/gntv_or_sync_fifo.mem/gbm.gbmg.gbmga.ngecc.bmg/inst_blk_mem_gen/gnbram.gnativebmg.native_blk_mem_gen/valid.cstr/ramloop[0].ram.r/SAFETY_CKT_GEN.RSTA_SHFT_REG_reg[2]' (FD) to 'inst/gen_fifo.fifo_gen_inst/inst_fifo_gen/gaxi_full_lite.gread_ch.grdch2.axi_rdch/grf.rf/gntv_or_sync_fifo.mem/gbm.gbmg.gbmga.ngecc.bmg/inst_blk_mem_gen/gnbram.gnativebmg.native_blk_mem_gen/valid.cstr/ramloop[0].ram.r/SAFETY_CKT_GEN.RSTB_SHFT_REG_reg[2]'
INFO: [Synth 8-3886] merging instance 'inst/gen_fifo.fifo_gen_inst/inst_fifo_gen/gaxi_full_lite.gread_ch.grdch2.axi_rdch/grf.rf/gntv_or_sync_fifo.mem/gbm.gbmg.gbmga.ngecc.bmg/inst_blk_mem_gen/gnbram.gnativebmg.native_blk_mem_gen/valid.cstr/ramloop[0].ram.r/SAFETY_CKT_GEN.RSTA_SHFT_REG_reg[3]' (FD) to 'inst/gen_fifo.fifo_gen_inst/inst_fifo_gen/gaxi_full_lite.gread_ch.grdch2.axi_rdch/grf.rf/gntv_or_sync_fifo.mem/gbm.gbmg.gbmga.ngecc.bmg/inst_blk_mem_gen/gnbram.gnativebmg.native_blk_mem_gen/valid.cstr/ramloop[0].ram.r/SAFETY_CKT_GEN.RSTB_SHFT_REG_reg[3]'
INFO: [Synth 8-3886] merging instance 'inst/gen_fifo.fifo_gen_inst/inst_fifo_gen/gaxi_full_lite.gread_ch.grdch2.axi_rdch/grf.rf/gntv_or_sync_fifo.mem/gbm.gbmg.gbmga.ngecc.bmg/inst_blk_mem_gen/gnbram.gnativebmg.native_blk_mem_gen/valid.cstr/ramloop[0].ram.r/SAFETY_CKT_GEN.RSTA_SHFT_REG_reg[4]' (FD) to 'inst/gen_fifo.fifo_gen_inst/inst_fifo_gen/gaxi_full_lite.gread_ch.grdch2.axi_rdch/grf.rf/gntv_or_sync_fifo.mem/gbm.gbmg.gbmga.ngecc.bmg/inst_blk_mem_gen/gnbram.gnativebmg.native_blk_mem_gen/valid.cstr/ramloop[0].ram.r/SAFETY_CKT_GEN.RSTB_SHFT_REG_reg[4]'
WARNING: [Synth 8-3332] Sequential element (inst_fifo_gen/gaxi_full_lite.gread_ch.grach2.axi_rach/grf.rf/gntv_or_sync_fifo.mem/goreg_dm.dout_i_reg[3]) is unused and will be removed from module fifo_generator_v13_2_2.
WARNING: [Synth 8-3332] Sequential element (inst_fifo_gen/gaxi_full_lite.gread_ch.grach2.axi_rach/grf.rf/gntv_or_sync_fifo.mem/goreg_dm.dout_i_reg[2]) is unused and will be removed from module fifo_generator_v13_2_2.
WARNING: [Synth 8-3332] Sequential element (inst_fifo_gen/gaxi_full_lite.gread_ch.grach2.axi_rach/grf.rf/gntv_or_sync_fifo.mem/goreg_dm.dout_i_reg[1]) is unused and will be removed from module fifo_generator_v13_2_2.
WARNING: [Synth 8-3332] Sequential element (inst_fifo_gen/gaxi_full_lite.gread_ch.grach2.axi_rach/grf.rf/gntv_or_sync_fifo.mem/goreg_dm.dout_i_reg[0]) is unused and will be removed from module fifo_generator_v13_2_2.
WARNING: [Synth 8-3332] Sequential element (inst_fifo_gen/gaxi_full_lite.gread_ch.grach2.gaxi_arvld.rach_pkt_reg_slice/gfwd_rev_pipeline1.storage_data1_reg[3]) is unused and will be removed from module fifo_generator_v13_2_2.
WARNING: [Synth 8-3332] Sequential element (inst_fifo_gen/gaxi_full_lite.gread_ch.grach2.gaxi_arvld.rach_pkt_reg_slice/gfwd_rev_pipeline1.storage_data1_reg[2]) is unused and will be removed from module fifo_generator_v13_2_2.
WARNING: [Synth 8-3332] Sequential element (inst_fifo_gen/gaxi_full_lite.gread_ch.grach2.gaxi_arvld.rach_pkt_reg_slice/gfwd_rev_pipeline1.storage_data1_reg[1]) is unused and will be removed from module fifo_generator_v13_2_2.
WARNING: [Synth 8-3332] Sequential element (inst_fifo_gen/gaxi_full_lite.gread_ch.grach2.gaxi_arvld.rach_pkt_reg_slice/gfwd_rev_pipeline1.storage_data1_reg[0]) is unused and will be removed from module fifo_generator_v13_2_2.
WARNING: [Synth 8-3332] Sequential element (inst_fifo_gen/gaxi_full_lite.gread_ch.grach2.axi_rach/grf.rf/gntv_or_sync_fifo.mem/gdm.dm_gen.dm/gpr1.dout_i_reg[3]) is unused and will be removed from module fifo_generator_v13_2_2.
WARNING: [Synth 8-3332] Sequential element (inst_fifo_gen/gaxi_full_lite.gread_ch.grach2.axi_rach/grf.rf/gntv_or_sync_fifo.mem/gdm.dm_gen.dm/gpr1.dout_i_reg[2]) is unused and will be removed from module fifo_generator_v13_2_2.
WARNING: [Synth 8-3332] Sequential element (inst_fifo_gen/gaxi_full_lite.gread_ch.grach2.axi_rach/grf.rf/gntv_or_sync_fifo.mem/gdm.dm_gen.dm/gpr1.dout_i_reg[1]) is unused and will be removed from module fifo_generator_v13_2_2.
WARNING: [Synth 8-3332] Sequential element (inst_fifo_gen/gaxi_full_lite.gread_ch.grach2.axi_rach/grf.rf/gntv_or_sync_fifo.mem/gdm.dm_gen.dm/gpr1.dout_i_reg[0]) is unused and will be removed from module fifo_generator_v13_2_2.
INFO: [Synth 8-3886] merging instance 'inst/gen_fifo.fifo_gen_inst/inst_fifo_gen/gaxi_full_lite.gread_ch.grdch2.axi_rdch/grf.rf/gntv_or_sync_fifo.mem/gbm.gbmg.gbmga.ngecc.bmg/inst_blk_mem_gen/gnbram.gnativebmg.native_blk_mem_gen/valid.cstr/ramloop[0].ram.r/SAFETY_CKT_GEN.POR_A_reg' (FD) to 'inst/gen_fifo.fifo_gen_inst/inst_fifo_gen/gaxi_full_lite.gread_ch.grdch2.axi_rdch/grf.rf/gntv_or_sync_fifo.mem/gbm.gbmg.gbmga.ngecc.bmg/inst_blk_mem_gen/gnbram.gnativebmg.native_blk_mem_gen/valid.cstr/ramloop[0].ram.r/SAFETY_CKT_GEN.POR_B_reg'
INFO: [Synth 8-3886] merging instance 'inst/gen_fifo.fifo_gen_inst/inst_fifo_gen/gaxi_full_lite.gread_ch.grdch2.axi_rdch/grf.rf/gntv_or_sync_fifo.mem/gbm.gbmg.gbmga.ngecc.bmg/inst_blk_mem_gen/gnbram.gnativebmg.native_blk_mem_gen/valid.cstr/ramloop[0].ram.r/SAFETY_CKT_GEN.ENA_NO_REG.ENA_dly_reg' (FD) to 'inst/gen_fifo.fifo_gen_inst/inst_fifo_gen/gaxi_full_lite.gread_ch.grdch2.axi_rdch/grf.rf/gntv_or_sync_fifo.mem/gbm.gbmg.gbmga.ngecc.bmg/inst_blk_mem_gen/gnbram.gnativebmg.native_blk_mem_gen/valid.cstr/ramloop[0].ram.r/SAFETY_CKT_GEN.ENB_NO_REG.ENB_dly_reg'
INFO: [Synth 8-3886] merging instance 'inst/gen_fifo.fifo_gen_inst/inst_fifo_gen/gaxi_full_lite.gread_ch.grdch2.axi_rdch/grf.rf/gntv_or_sync_fifo.mem/gbm.gbmg.gbmga.ngecc.bmg/inst_blk_mem_gen/gnbram.gnativebmg.native_blk_mem_gen/valid.cstr/ramloop[0].ram.r/SAFETY_CKT_GEN.ENA_NO_REG.ENA_dly_D_reg' (FD) to 'inst/gen_fifo.fifo_gen_inst/inst_fifo_gen/gaxi_full_lite.gread_ch.grdch2.axi_rdch/grf.rf/gntv_or_sync_fifo.mem/gbm.gbmg.gbmga.ngecc.bmg/inst_blk_mem_gen/gnbram.gnativebmg.native_blk_mem_gen/valid.cstr/ramloop[0].ram.r/SAFETY_CKT_GEN.ENB_NO_REG.ENB_dly_D_reg'
---------------------------------------------------------------------------------
Finished Cross Boundary and Area Optimization : Time (s): cpu = 00:01:47 ; elapsed = 00:01:52 . Memory (MB): peak = 975.691 ; gain = 530.258
---------------------------------------------------------------------------------
---------------------------------------------------------------------------------
Start ROM, RAM, DSP and Shift Register Reporting
---------------------------------------------------------------------------------

Distributed RAM: Preliminary Mapping  Report (see note below)
+------------------------------+----------------------------------------------------------------------------------------------------------+----------------+----------------------+---------------+
|Module Name                   | RTL Object                                                                                               | Inference      | Size (Depth x Width) | Primitives    | 
+------------------------------+----------------------------------------------------------------------------------------------------------+----------------+----------------------+---------------+
|inst/\gen_fifo.fifo_gen_inst  | inst_fifo_gen/gaxi_full_lite.gread_ch.grach2.axi_rach/grf.rf/gntv_or_sync_fifo.mem/gdm.dm_gen.dm/RAM_reg | User Attribute | 32 x 60              | RAM32M x 10   | 
+------------------------------+----------------------------------------------------------------------------------------------------------+----------------+----------------------+---------------+

Note: The table above is a preliminary report that shows the Distributed RAMs at the current stage of the synthesis flow. Some Distributed RAMs may be reimplemented as non Distributed RAM primitives later in the synthesis flow. Multiple instantiated RAMs are reported only once.
---------------------------------------------------------------------------------
Finished ROM, RAM, DSP and Shift Register Reporting
---------------------------------------------------------------------------------

Report RTL Partitions: 
+-+--------------+------------+----------+
| |RTL Partition |Replication |Instances |
+-+--------------+------------+----------+
+-+--------------+------------+----------+
---------------------------------------------------------------------------------
Start Applying XDC Timing Constraints
---------------------------------------------------------------------------------
---------------------------------------------------------------------------------
Finished Applying XDC Timing Constraints : Time (s): cpu = 00:01:59 ; elapsed = 00:02:05 . Memory (MB): peak = 984.406 ; gain = 538.973
---------------------------------------------------------------------------------
---------------------------------------------------------------------------------
Start Timing Optimization
---------------------------------------------------------------------------------
---------------------------------------------------------------------------------
Finished Timing Optimization : Time (s): cpu = 00:02:00 ; elapsed = 00:02:06 . Memory (MB): peak = 1007.750 ; gain = 562.316
---------------------------------------------------------------------------------

Report RTL Partitions: 
+-+--------------+------------+----------+
| |RTL Partition |Replication |Instances |
+-+--------------+------------+----------+
+-+--------------+------------+----------+
---------------------------------------------------------------------------------
Start Technology Mapping
---------------------------------------------------------------------------------
---------------------------------------------------------------------------------
Finished Technology Mapping : Time (s): cpu = 00:02:00 ; elapsed = 00:02:07 . Memory (MB): peak = 1007.750 ; gain = 562.316
---------------------------------------------------------------------------------

Report RTL Partitions: 
+-+--------------+------------+----------+
| |RTL Partition |Replication |Instances |
+-+--------------+------------+----------+
+-+--------------+------------+----------+
---------------------------------------------------------------------------------
Start IO Insertion
---------------------------------------------------------------------------------
---------------------------------------------------------------------------------
Start Flattening Before IO Insertion
---------------------------------------------------------------------------------
---------------------------------------------------------------------------------
Finished Flattening Before IO Insertion
---------------------------------------------------------------------------------
---------------------------------------------------------------------------------
Start Final Netlist Cleanup
---------------------------------------------------------------------------------
---------------------------------------------------------------------------------
Finished Final Netlist Cleanup
---------------------------------------------------------------------------------
---------------------------------------------------------------------------------
Finished IO Insertion : Time (s): cpu = 00:02:01 ; elapsed = 00:02:08 . Memory (MB): peak = 1007.750 ; gain = 562.316
---------------------------------------------------------------------------------

Report Check Netlist: 
+------+------------------+-------+---------+-------+------------------+
|      |Item              |Errors |Warnings |Status |Description       |
+------+------------------+-------+---------+-------+------------------+
|1     |multi_driven_nets |      0|        0|Passed |Multi driven nets |
+------+------------------+-------+---------+-------+------------------+
---------------------------------------------------------------------------------
Start Renaming Generated Instances
---------------------------------------------------------------------------------
---------------------------------------------------------------------------------
Finished Renaming Generated Instances : Time (s): cpu = 00:02:01 ; elapsed = 00:02:08 . Memory (MB): peak = 1007.750 ; gain = 562.316
---------------------------------------------------------------------------------

Report RTL Partitions: 
+-+--------------+------------+----------+
| |RTL Partition |Replication |Instances |
+-+--------------+------------+----------+
+-+--------------+------------+----------+
---------------------------------------------------------------------------------
Start Rebuilding User Hierarchy
---------------------------------------------------------------------------------
---------------------------------------------------------------------------------
Finished Rebuilding User Hierarchy : Time (s): cpu = 00:02:01 ; elapsed = 00:02:08 . Memory (MB): peak = 1007.750 ; gain = 562.316
---------------------------------------------------------------------------------
---------------------------------------------------------------------------------
Start Renaming Generated Ports
---------------------------------------------------------------------------------
---------------------------------------------------------------------------------
Finished Renaming Generated Ports : Time (s): cpu = 00:02:01 ; elapsed = 00:02:08 . Memory (MB): peak = 1007.750 ; gain = 562.316
---------------------------------------------------------------------------------
---------------------------------------------------------------------------------
Start Handling Custom Attributes
---------------------------------------------------------------------------------
---------------------------------------------------------------------------------
Finished Handling Custom Attributes : Time (s): cpu = 00:02:01 ; elapsed = 00:02:08 . Memory (MB): peak = 1007.750 ; gain = 562.316
---------------------------------------------------------------------------------
---------------------------------------------------------------------------------
Start Renaming Generated Nets
---------------------------------------------------------------------------------
---------------------------------------------------------------------------------
Finished Renaming Generated Nets : Time (s): cpu = 00:02:01 ; elapsed = 00:02:08 . Memory (MB): peak = 1007.750 ; gain = 562.316
---------------------------------------------------------------------------------
---------------------------------------------------------------------------------
Start ROM, RAM, DSP and Shift Register Reporting
---------------------------------------------------------------------------------

Static Shift Register Report:
+-----------------------+-----------------------------------------------------------------------------------------------------------------------------------------------------------------------------------------------------------------------------------+--------+-------+--------------+--------------------+-------------------+--------+---------+
|Module Name            | RTL Name                                                                                                                                                                                                                          | Length | Width | Reset Signal | Pull out first Reg | Pull out last Reg | SRL16E | SRLC32E | 
+-----------------------+-----------------------------------------------------------------------------------------------------------------------------------------------------------------------------------------------------------------------------------+--------+-------+--------------+--------------------+-------------------+--------+---------+
|fifo_generator_v13_2_2 | inst_fifo_gen/gaxi_full_lite.gread_ch.grdch2.axi_rdch/grf.rf/gntv_or_sync_fifo.mem/gbm.gbmg.gbmga.ngecc.bmg/inst_blk_mem_gen/gnbram.gnativebmg.native_blk_mem_gen/valid.cstr/ramloop[0].ram.r/SAFETY_CKT_GEN.RSTB_SHFT_REG_reg[4] | 4      | 1     | NO           | NO                 | YES               | 1      | 0       | 
+-----------------------+-----------------------------------------------------------------------------------------------------------------------------------------------------------------------------------------------------------------------------------+--------+-------+--------------+--------------------+-------------------+--------+---------+

---------------------------------------------------------------------------------
Finished ROM, RAM, DSP and Shift Register Reporting
---------------------------------------------------------------------------------
---------------------------------------------------------------------------------
Start Writing Synthesis Report
---------------------------------------------------------------------------------

Report BlackBoxes: 
+-+--------------+----------+
| |BlackBox name |Instances |
+-+--------------+----------+
+-+--------------+----------+

Report Cell Usage: 
+------+---------+------+
|      |Cell     |Count |
+------+---------+------+
|1     |CARRY4   |     8|
|2     |LUT1     |    20|
|3     |LUT2     |    27|
|4     |LUT3     |    21|
|5     |LUT4     |    34|
|6     |LUT5     |    22|
|7     |LUT6     |    23|
|8     |MUXCY    |    20|
|9     |RAM32M   |    10|
|10    |RAMB36E1 |     1|
|11    |SRL16E   |     1|
|12    |FDCE     |    30|
|13    |FDPE     |    27|
|14    |FDRE     |   305|
|15    |FDSE     |    12|
+------+---------+------+

Report Instance Areas: 
+------+-----------------------------------------------------------------------------+---------------------------------------+------+
|      |Instance                                                                     |Module                                 |Cells |
+------+-----------------------------------------------------------------------------+---------------------------------------+------+
|1     |top                                                                          |                                       |   561|
|2     |  inst                                                                       |axi_data_fifo_v2_1_15_axi_data_fifo    |   561|
|3     |    \gen_fifo.fifo_gen_inst                                                  |fifo_generator_v13_2_2                 |   561|
|4     |      inst_fifo_gen                                                          |fifo_generator_v13_2_2_synth           |   561|
|5     |        \gaxi_full_lite.gread_ch.grach2.axi_rach                             |fifo_generator_top                     |   232|
|6     |          \grf.rf                                                            |fifo_generator_ramfifo                 |   232|
|7     |            \gntv_or_sync_fifo.gl0.rd                                        |rd_logic                               |    41|
|8     |              \gr1.gr1_int.rfwft                                             |rd_fwft                                |    24|
|9     |              \grss.rsts                                                     |rd_status_flags_ss                     |     2|
|10    |              rpntr                                                          |rd_bin_cntr                            |    15|
|11    |            \gntv_or_sync_fifo.gl0.wr                                        |wr_logic                               |    29|
|12    |              \gwss.wsts                                                     |wr_status_flags_ss                     |     7|
|13    |              wpntr                                                          |wr_bin_cntr                            |    22|
|14    |            \gntv_or_sync_fifo.mem                                           |memory                                 |   150|
|15    |              \gdm.dm_gen.dm                                                 |dmem                                   |    66|
|16    |            rstblk                                                           |reset_blk_ramfifo__parameterized0      |    12|
|17    |              \ngwrdrst.grst.g7serrst.gnsckt_wrst.rst_wr_reg2_inst           |xpm_cdc_async_rst__2                   |     2|
|18    |        \gaxi_full_lite.gread_ch.grach2.gaxi_arvld.rach_pkt_reg_slice        |axi_reg_slice                          |    75|
|19    |          rstblk                                                             |reset_blk_ramfifo__parameterized1      |    15|
|20    |            \ngwrdrst.grst.g7serrst.gnsckt_wrst.rst_wr_reg2_inst             |xpm_cdc_async_rst                      |     2|
|21    |        \gaxi_full_lite.gread_ch.grdch2.axi_rdch                             |fifo_generator_top__parameterized0     |   216|
|22    |          \grf.rf                                                            |fifo_generator_ramfifo__parameterized0 |   216|
|23    |            \gntv_or_sync_fifo.gl0.rd                                        |rd_logic__parameterized0               |    74|
|24    |              \gr1.gr1_int.rfwft                                             |rd_fwft__parameterized0                |    17|
|25    |              \grss.rsts                                                     |rd_status_flags_ss__parameterized0     |    13|
|26    |                c1                                                           |compare__parameterized0_1              |     5|
|27    |                c2                                                           |compare__parameterized0_2              |     6|
|28    |              rpntr                                                          |rd_bin_cntr__parameterized0            |    44|
|29    |            \gntv_or_sync_fifo.gl0.wr                                        |wr_logic__parameterized0               |    49|
|30    |              \gwss.wsts                                                     |wr_status_flags_ss__parameterized0     |    17|
|31    |                c0                                                           |compare__parameterized0                |     5|
|32    |                c1                                                           |compare__parameterized0_0              |     6|
|33    |              wpntr                                                          |wr_bin_cntr__parameterized0            |    32|
|34    |            \gntv_or_sync_fifo.mem                                           |memory__parameterized0                 |    78|
|35    |              \gbm.gbmg.gbmga.ngecc.bmg                                      |blk_mem_gen_v8_4_1                     |     9|
|36    |                inst_blk_mem_gen                                             |blk_mem_gen_v8_4_1_synth               |     9|
|37    |                  \gnbram.gnativebmg.native_blk_mem_gen                      |blk_mem_gen_top                        |     9|
|38    |                    \valid.cstr                                              |blk_mem_gen_generic_cstr               |     9|
|39    |                      \ramloop[0].ram.r                                      |blk_mem_gen_prim_width                 |     9|
|40    |                        \prim_noinit.ram                                     |blk_mem_gen_prim_wrapper               |     2|
|41    |            rstblk                                                           |reset_blk_ramfifo__parameterized2      |    15|
|42    |              \ngwrdrst.grst.g7serrst.gsckt_wrst.xpm_cdc_sync_rst_inst_wrst  |xpm_cdc_sync_rst                       |     5|
|43    |        \reset_gen_cc.rstblk_cc                                              |reset_blk_ramfifo                      |    12|
|44    |          \ngwrdrst.grst.g7serrst.gnsckt_wrst.rst_wr_reg2_inst               |xpm_cdc_async_rst__1                   |     2|
+------+-----------------------------------------------------------------------------+---------------------------------------+------+
---------------------------------------------------------------------------------
Finished Writing Synthesis Report : Time (s): cpu = 00:02:01 ; elapsed = 00:02:08 . Memory (MB): peak = 1007.750 ; gain = 562.316
---------------------------------------------------------------------------------
Synthesis finished with 0 errors, 0 critical warnings and 293 warnings.
Synthesis Optimization Runtime : Time (s): cpu = 00:00:25 ; elapsed = 00:01:55 . Memory (MB): peak = 1007.750 ; gain = 356.422
Synthesis Optimization Complete : Time (s): cpu = 00:02:02 ; elapsed = 00:02:08 . Memory (MB): peak = 1007.750 ; gain = 562.316
INFO: [Project 1-571] Translating synthesized netlist
INFO: [Netlist 29-17] Analyzing 39 Unisim elements for replacement
INFO: [Netlist 29-28] Unisim Transformation completed in 0 CPU seconds
INFO: [Project 1-570] Preparing netlist for logic optimization
Sourcing Tcl File [D:/Xilinx/Vivado/2018.1/data/ip/xpm/xpm_cdc/tcl/xpm_cdc_async_rst.tcl] for cell 'inst/gen_fifo.fifo_gen_inst/inst_fifo_gen/gaxi_full_lite.gread_ch.grach2.gaxi_arvld.rach_pkt_reg_slice/rstblk/ngwrdrst.grst.g7serrst.gnsckt_wrst.rst_wr_reg2_inst'
INFO: [Timing 38-35] Done setting XDC timing constraints. [D:/Xilinx/Vivado/2018.1/data/ip/xpm/xpm_cdc/tcl/xpm_cdc_async_rst.tcl:2]
all_registers: Time (s): cpu = 00:00:07 ; elapsed = 00:00:07 . Memory (MB): peak = 1515.672 ; gain = 499.379
Finished Sourcing Tcl File [D:/Xilinx/Vivado/2018.1/data/ip/xpm/xpm_cdc/tcl/xpm_cdc_async_rst.tcl] for cell 'inst/gen_fifo.fifo_gen_inst/inst_fifo_gen/gaxi_full_lite.gread_ch.grach2.gaxi_arvld.rach_pkt_reg_slice/rstblk/ngwrdrst.grst.g7serrst.gnsckt_wrst.rst_wr_reg2_inst'
Sourcing Tcl File [D:/Xilinx/Vivado/2018.1/data/ip/xpm/xpm_cdc/tcl/xpm_cdc_async_rst.tcl] for cell 'inst/gen_fifo.fifo_gen_inst/inst_fifo_gen/reset_gen_cc.rstblk_cc/ngwrdrst.grst.g7serrst.gnsckt_wrst.rst_wr_reg2_inst'
Finished Sourcing Tcl File [D:/Xilinx/Vivado/2018.1/data/ip/xpm/xpm_cdc/tcl/xpm_cdc_async_rst.tcl] for cell 'inst/gen_fifo.fifo_gen_inst/inst_fifo_gen/reset_gen_cc.rstblk_cc/ngwrdrst.grst.g7serrst.gnsckt_wrst.rst_wr_reg2_inst'
Sourcing Tcl File [D:/Xilinx/Vivado/2018.1/data/ip/xpm/xpm_cdc/tcl/xpm_cdc_async_rst.tcl] for cell 'inst/gen_fifo.fifo_gen_inst/inst_fifo_gen/gaxi_full_lite.gread_ch.grach2.axi_rach/grf.rf/rstblk/ngwrdrst.grst.g7serrst.gnsckt_wrst.rst_wr_reg2_inst'
Finished Sourcing Tcl File [D:/Xilinx/Vivado/2018.1/data/ip/xpm/xpm_cdc/tcl/xpm_cdc_async_rst.tcl] for cell 'inst/gen_fifo.fifo_gen_inst/inst_fifo_gen/gaxi_full_lite.gread_ch.grach2.axi_rach/grf.rf/rstblk/ngwrdrst.grst.g7serrst.gnsckt_wrst.rst_wr_reg2_inst'
Sourcing Tcl File [D:/Xilinx/Vivado/2018.1/data/ip/xpm/xpm_cdc/tcl/xpm_cdc_sync_rst.tcl] for cell 'inst/gen_fifo.fifo_gen_inst/inst_fifo_gen/gaxi_full_lite.gread_ch.grdch2.axi_rdch/grf.rf/rstblk/ngwrdrst.grst.g7serrst.gsckt_wrst.xpm_cdc_sync_rst_inst_wrst'
Finished Sourcing Tcl File [D:/Xilinx/Vivado/2018.1/data/ip/xpm/xpm_cdc/tcl/xpm_cdc_sync_rst.tcl] for cell 'inst/gen_fifo.fifo_gen_inst/inst_fifo_gen/gaxi_full_lite.gread_ch.grdch2.axi_rdch/grf.rf/rstblk/ngwrdrst.grst.g7serrst.gsckt_wrst.xpm_cdc_sync_rst_inst_wrst'
INFO: [Opt 31-138] Pushed 0 inverter(s) to 0 load pin(s).
INFO: [Project 1-111] Unisim Transformation Summary:
  A total of 18 instances were transformed.
  (MUXCY,XORCY) => CARRY4: 8 instances
  RAM32M => RAM32M (RAMD32, RAMD32, RAMD32, RAMD32, RAMD32, RAMD32, RAMS32, RAMS32): 10 instances

INFO: [Common 17-83] Releasing license: Synthesis
36 Infos, 112 Warnings, 0 Critical Warnings and 0 Errors encountered.
synth_design completed successfully
synth_design: Time (s): cpu = 00:02:12 ; elapsed = 00:02:20 . Memory (MB): peak = 1515.672 ; gain = 1070.238
INFO: [Common 17-600] The following parameters have non-default value.
general.maxThreads
INFO: [Common 17-1381] The checkpoint 'E:/xfOpenCV/wksp_2018_1/nnp_mmult_04/Debug/_sds/p0/_vpl/ipi/syn/syn.runs/nnp_stream_bd_s00_data_fifo_2_synth_1/nnp_stream_bd_s00_data_fifo_2.dcp' has been generated.
